<Application
    xmlns:xsi="http://www.w3.org/2001/XMLSchema-instance"
    xmlns="http://www.inc.com"
    xsi:schemaLocation="http://www.inc.com Application.xsd"
>

    <applicantID>APP-1234</applicantID>
    <age>20</age>
    <email>kiran@gmail.com</email>
    <phoneNumber>9827364010</phoneNumber>
    <education>phd</education>

    <skills>
        <skill>Writing</skill>
        <skill>Games</skill>
    </skills>

    <experienceYears>2</experienceYears>
    <portfolioURL>https://www.linkedin.com</portfolioURL>

</Application>